query,url,comment
조현아,https://n.news.naver.com/mnews/article/469/0000036284?sid=101, 대한 이러는 문구를때라 워째 대한민국을 대표하는 뉘앙수가 풍긴다 
조현아,https://n.news.naver.com/mnews/article/469/0000036284?sid=101, 재계는 그렇다치고 법조계가 왜 안타까와 하는지? 
조현아,https://n.news.naver.com/mnews/article/469/0000036284?sid=101," 이항공사는주인이바뀌어야정신을차릴것같네~국민자체를이주~졸~루보구있네~자기들혼자큰것처럼대단한착각들을하고있다~국민을우습게보는모든자들은혼나야된다~누구던~어떤집단이던,,,,,"
조현아,https://n.news.naver.com/mnews/article/469/0000036296?sid=102,
조현아,https://n.news.naver.com/mnews/article/469/0000036489?sid=110,
조현아,https://n.news.naver.com/mnews/article/469/0000036490?sid=110,
조현아,https://n.news.naver.com/mnews/article/469/0000036549?sid=101,
조현아,https://n.news.naver.com/mnews/article/469/0000036710?sid=101,세무조사가 답이다 국세청 뭐합니까
조현아,https://n.news.naver.com/mnews/article/469/0000036526?sid=101,정윤회사건을 묻으려고하든 정치적인 쇼 든간에. 뱅기를 맘대로 떡주무르듯하고 인권을무시한 무식한처사는 분명잘못된거아닌가요? 힘없고 돈없는 사람은 무시받고 맘대로 무릎꿇리는 행태는 분명 벌받아마땅하다고 봅니다.. 서민들은 조금만잘못해도 벌금나오고 징역사는데 재벌이라고 맘대로하는짓꺼리는 일벌백계로 다스려야하는것이고.. 법앞에 평등한 대한민국이 되어야하는것이 맞다고봅니다. 
조현아,https://n.news.naver.com/mnews/article/469/0000036526?sid=101, 국토부OOO들 손목에도 수갑채우고 존재가치가 없는 정부부서가 국토부인걸 다시한번 인증했다. 고발자의 조사일을 회사에 알려주고 고발자한테 불이익과 협박에 시달리게한게 국토부다. 그리고 조사일에 회사임원과 희희낙락하는 모습을 보여주고 사무장이 거짓말했다고 헛소리를 지껄이는 국토부가 제정신이냐??? 이번기회에 진짜로 없애라 필요없는 OOO 공무원들을 세금으로 왜 먹여살려야 하냐고. . . 
조현아,https://n.news.naver.com/mnews/article/469/0000036526?sid=101, 슈렉 밑에 떨어지는 부스러기라도 챙기고싶은 간절한마음 딱좋은 기회인데 A씨가대한항공을 두번죽이네 걍 개처럼 기든가 납짝엎드리고있어 짖지말고!! 
조현아,https://n.news.naver.com/mnews/article/469/0000036526?sid=101, 사무장은 개가 아닌 사람을 택했는데 A씨는 개를 택했구나 멍멍짓고 귀여움 많이 받으세요 
조현아,https://n.news.naver.com/mnews/article/469/0000036526?sid=101," 그래서 용서하고 또 용서하는 것이다!만약에 혹시라도 단 한번의 실수나 허물만으로 풀어지고 벗어 날 수 있었다면,부처님께서는 해탈이라는 말보다 다른 말씀을 하셨을 것이다!인간이란 중생 중에 여기에서 자유로울 수 있는 이가 단 한사람도 없음을 안다면,백만 번을 백만 번이라도 용서하고 또 용서하여야 하느니!!!"
조현아,https://n.news.naver.com/mnews/article/469/0000036650?sid=103,
조현아,https://n.news.naver.com/mnews/article/469/0000036530?sid=101,ㅋㅋㅋㅋㅋ 진째 개정부 한통속 
조현아,https://n.news.naver.com/mnews/article/469/0000036530?sid=101, 한심한대한민국?국토부가이랬단말인가?재벌에아첨하고던져주는양식이나처먹으며국토부에서근무하는공무원이란말인가?한심한정부와더러운3류부서국토부의현실앞에차라리이나라의국민이기를포기하고싶다.대통령은왜국민의관심이이리도큰데한말씀도없으시나요?오호 통재라.불쌍한국민들!!!!!!! 
조현아,https://n.news.naver.com/mnews/article/469/0000036530?sid=101," 말뿐인 ""관피아 척결""...한심해요...ㅉㅉㅉ "
조현아,https://n.news.naver.com/mnews/article/469/0000036530?sid=101, 아... 이게 바로 MB의 비지니스 프렌들리라는 거구나.... 전형적 후진국 모델... 세상 어느 선진국이 규제를 강화하지 비지니스 프렌들리란걸 하냐.... 박정희를 지나 다른 대통령때는 그래도 경제 정치적으로 선진국을 향해 갔는데... MB와 공주님을 지나면서 도루 후진국으로 가는구나... 
조현아,https://n.news.naver.com/mnews/article/469/0000036530?sid=101, 여기는 죄다 열등감.찌질이만 있네
조현아,https://n.news.naver.com/mnews/article/469/0000036534?sid=102,
조현아,https://n.news.naver.com/mnews/article/469/0000036713?sid=100,특검가자... 2004년이면 노무현정권이고 문희상은 집권당 대표다
조현아,https://n.news.naver.com/mnews/article/469/0000036527?sid=100,
조현아,https://n.news.naver.com/mnews/article/469/0000036899?sid=101,춥다고 두른 목도리도 보기싫다 
조현아,https://n.news.naver.com/mnews/article/469/0000036899?sid=101, ㅋㅋㅋㅋㅋㅋ이뭐병 
조현아,https://n.news.naver.com/mnews/article/469/0000036899?sid=101, 이 시-팔-연님아 배고프고 짤리는 공포에 비하면 이건 껌값이냐 시 발 -연아 악어의 눈물 
조현아,https://n.news.naver.com/mnews/article/469/0000036899?sid=101, 저런 젓팔게 닮은뇬이 경복궁옆에 칠성급호텔을 지은다고 로비중이라네요!! 동생놈은 전에 노인을 두들겨패서 문란을 일으킨바 있고... 좌우지간 OOO 집구석인듯!! 
조현아,https://n.news.naver.com/mnews/article/469/0000036899?sid=101, 일반인이면 징역 몇년? 대략 한 구형 3년에 선고 1년6월정도 살지 싫다.당연 항소심 기각
조현아,https://n.news.naver.com/mnews/article/469/0000036813?sid=102,아니.. 고개는 푹 숙이고 눈만 하늘로 뜨고 죄송합니다 하면 OOO아 그게 미안한거냐....?? 진정어린 사과도 못하는 주제에 쯧쯧 그동안 한진항공 승무원들 고생했겠네 진짜 
조현아,https://n.news.naver.com/mnews/article/469/0000036813?sid=102, OOO 진정성이 없어 가식이지 ㅋㅋ 국토부 조사받는데 쓰레기 치워달래 ㅋㅋ 개 꼴통 
조현아,https://n.news.naver.com/mnews/article/469/0000036813?sid=102, 쫌 심하네 ㅋㅋㅋㅋㅋㅋ 휴 ㅉㅉ 
조현아,https://n.news.naver.com/mnews/article/469/0000036813?sid=102, 많은 사람들이 이용하는 항공에서 사람들 폭행하고 마음대로 회항을 시킨일이 있었더 것이 안타깝습니다.앞으로는 이러한 일이 생기지 않도록 법도 강화하고 사람을 고용할때도 인성을 중요하게 생각하였으면 좋겟습니다.
조현아,https://n.news.naver.com/mnews/article/469/0000036775?sid=101,이게 바로 한국의 리얼한 단면 그 자체다. 돈이 권력이고 인격이고 요술망방이인 천민자본주의의 전형. 
조현아,https://n.news.naver.com/mnews/article/469/0000036775?sid=101, 이제 우리나라 주인이 재벌을 중심으로 한 경제권력임이 정확히 확인되었음. ..문희상 의원이 처남의 취직을 대한항공에 청탁한 일을 시인한 것을 보면 ... 정치인과 공무원. 기장들은 그들의 하인이고 ... 사무장을 포함한 국민들은 ..그들이 때리면 그냥 맞아야 하는 노예일 뿐이다 ...백성들은 분노만이 남았다... 
조현아,https://n.news.naver.com/mnews/article/469/0000036775?sid=101, 고양이와 생선이네. 국토부 감사해야 한다. 온 국민적 관심이 쏠린 사안인데도 짜고 치는데다른 사안은 어떨지 안봐도 뻔하다. 정말 다들 들어내서 파묻고 싶다. 
조현아,https://n.news.naver.com/mnews/article/469/0000036775?sid=101, 그넘들 참 가관이군...그렇게 대대손손 재벌가에 빌 붙어서 살 놈들이네 그려... 
조현아,https://n.news.naver.com/mnews/article/469/0000036775?sid=101, 허위조사에 국토부직원이 관여 했다면 그 또한 처벌해야 한다
조현아,https://n.news.naver.com/mnews/article/469/0000037003?sid=102,
조현아,https://n.news.naver.com/mnews/article/469/0000036994?sid=103,
조현아,https://n.news.naver.com/mnews/article/469/0000037257?sid=101,다 잡아야하는거 아닌가? 
조현아,https://n.news.naver.com/mnews/article/469/0000037257?sid=101," 작금 조현아를 옹호할 마음은 없다. 죄지은 만큼만 벌 받으면 된다. 이게 상식이요 조리다. 작금의 언론 보도행태는 물론, 헌법 법률 명령 규칙 조례위에 군림하는 국민 정서법에 좌지 우지하는 이런 후진성은 이젠 극복해야한다. 그리고 30대 중반 넘는 사무장이, 제가 사무장이라도, 설사 승객으로 탑승햇다해도 회사 임원인 조현아가 타면 긴장하고 기내라도 업무지시는 통상 있는 일인데 승객으로 탔지 임원 신분으로 탑승은 아니다라는 논의도 상식상 이해가 안간다. 엉터리 대한민국, 엉터리 국민 정서법, 만세 이순신의 작은 후예 "
조현아,https://n.news.naver.com/mnews/article/469/0000037257?sid=101," 이번사건은 전세계에서 주목하고 있다.제발 재벌2,3세 인격성 문제를 떠나.. 사법부만이라도 쪽팔리지않게 수사하고 결론내려 주길바랍니다. "
조현아,https://n.news.naver.com/mnews/article/469/0000037257?sid=101, 사무장님 힘내세요ㅠㅠㅠㅠㅠ 
조현아,https://n.news.naver.com/mnews/article/469/0000037257?sid=101, 어이없네 정신못차린 여자네 검찰청에서도 증거인멸 부인?? 네 아비가 시켰냐?? 그럼 여상무가 알아서 움직였을까?? 왜그러니 정말~~~~ 너 때문에 노예직원들 어디 눈치보여 일하겠니?? 너때문에 생긴일야 제발 그만좀 끝내!! 대한항공 간판 내려!! 또라이가 뱅기도 모자라 온나란를 들쑤시네!!
박나래,https://n.news.naver.com/mnews/article/032/0003062975?sid=103,
박나래,https://n.news.naver.com/mnews/article/005/0001417070?sid=103,
박나래,https://n.news.naver.com/mnews/article/005/0001418105?sid=103, 우리나라는 스토리텔링은 여자가 싹쓸이했는디.. 
박나래,https://n.news.naver.com/mnews/article/005/0001418105?sid=103, 발굴은 좋은데 실력으로 뽑자.... 
박나래,https://n.news.naver.com/mnews/article/005/0001418105?sid=103, 여성의 날을 맞이하여 넷플릭스가 차세대 여성 스토리텔러를 키운다는 좋은 것은 정말 좋은 취지인것 같아요. 실력있는 여성들에게 기회를 많이 주시고 제 실력을 맘껏 펼칠수 있도록 다양한 기회를 주시면 좋겠습니다. 
박나래,https://n.news.naver.com/mnews/article/005/0001418105?sid=103," ""82년생 김지영""같은 작품을 많이 만들어달란 의미임?"
박나래,https://n.news.naver.com/mnews/article/021/0002464673?sid=103,  이승윤님 나오는 유명가수전 기대하고 있습니다~자작곡 많이 불러주세요~날아가자♡♡♡ 
박나래,https://n.news.naver.com/mnews/article/021/0002464673?sid=103, 미스유랑단 아니고 매직유랑단 
박나래,https://n.news.naver.com/mnews/article/021/0002464673?sid=103, 철인왕후 👏👏💟💟
박나래,https://n.news.naver.com/mnews/article/022/0003559092?sid=105,
박나래,https://n.news.naver.com/mnews/article/025/0003080559?sid=103, 내글도 넷플 코인 탔으면 좋겠다 
박나래,https://n.news.naver.com/mnews/article/025/0003080559?sid=103," 영역 자막 품질이 완벽하지가 않아요. 신경 좀 쓰세요. 언젠가 더 나은 번역사가 있는 업체에게로 가겠지만, 그 동안 쌓이는 수많은 오류 등은 자랑으로 삼을 모양인지.. "
박나래,https://n.news.naver.com/mnews/article/025/0003080559?sid=103, 
박나래,https://n.news.naver.com/mnews/article/005/0001424256?sid=102,  왜 남자만 연애계떠나냐. 너도떠나라 
박나래,https://n.news.naver.com/mnews/article/005/0001424256?sid=102,"  그럴줄알았다,,나대는거 꼴보기 싫어 박나래 때문에 안보는 프로가 몇개인지,,,,,박원순 따라하기네,,"
박나래,https://n.news.naver.com/mnews/article/005/0001424235?sid=103,   평소에도 저런다는 거잖아ㅠ 가끔씩보면 일부러 더하는거 같음ㅉㅉ 
박나래,https://n.news.naver.com/mnews/article/005/0001424235?sid=103, 애는 또 싫은게 프로그램에 지 친한 애들만 골라서 다 불러 하는짓이 꼭 뭉가하고 닮았네
박나래,https://n.news.naver.com/mnews/article/005/0001424318?sid=103,상상력을 빙자한 매국행위를 멈춰야한다는 교훈을 얻어야지 
박나래,https://n.news.naver.com/mnews/article/005/0001424318?sid=103," ""중국이 한국 픽션 드라마를 증거로 동북공정의 근거로 삼을 만큼 어리석은 나라인가"" 네. 벌써 시작했는데요? "
박나래,https://n.news.naver.com/mnews/article/005/0001424318?sid=103, 픽션 드라마인데 왜 과한 반응을 하냐 하는 인간들은 머가리 비었냐? 아무리 픽션 드라마라도 가공의 인물이 아닌 실제 역사적 인물을 왜곡해서 드라마를 제작하는데 문제가 없다고?ㅋㅋ 진짜 머가리 비었네 ㅋㅋ차라리 픽션 드라마이면 픽션 드라마 답게 실제 역사적 인물들을 차용해서 할게 아니라 가상의 인물들을 만들어서 픽션 드라마를 만들던가 이건 뭐 그것도 아니고 실제 역사적 인물을 왜곡하면서 만들었는데 문제가 없다고 생각하며 헛소리 하는 인간들은 머가리 치료 받아라. 
박나래,https://n.news.naver.com/mnews/article/005/0001424318?sid=103, 몰 어떻게 봐야 하나냐? 저거 심의없이 제작하고 방송보낸 사람들 정신이 썩은 거지 제정신이 아니고서야 저딴 말도 안되는 방송을 내보내냐? 이참에 방송국 개혁도 해야함!! 젠장 이나라는 몬놈의 개혁할게 이리도 많남..;; 
박나래,https://n.news.naver.com/mnews/article/005/0001424318?sid=103, 제작진이 대깨 좌파라 그럼
박나래,https://n.news.naver.com/mnews/article/005/0001424852?sid=110,공정한 캔슬 컬처를 지지합니다 
박나래,https://n.news.naver.com/mnews/article/005/0001424852?sid=110, 남자가 여자인형에 그랬다면.. 그남자는 어떻게 되었을까?
박나래,https://n.news.naver.com/mnews/article/020/0003347111?sid=102," 와 진짜 요즘 시대에 이런게 말이 되나? 남녀만 바뀌고 같은 상황이었어봐, 너무 화가나서 손발이 부들부들 떨린다 "
박나래,https://n.news.naver.com/mnews/article/020/0003347111?sid=102,  헐 무슨 19금 영화인줄 알았네 미친 
박나래,https://n.news.naver.com/mnews/article/020/0003347111?sid=102, 
박나래,https://n.news.naver.com/mnews/article/023/0003604207?sid=103,사과는 됐고... 나혼산에서 하차하세요 
박나래,https://n.news.naver.com/mnews/article/023/0003604207?sid=103,   사과문 줄도 안맞고 내용 요지도 없고 맨정신에 쓴거 아닌거같은데 ㅋㅋㅋㅋㅋ 
박나래,https://n.news.naver.com/mnews/article/023/0003604207?sid=103, 그냥 지나갈 수도 있는 일인데 모든걸 불편하게 만드는 페미들이 원하는 모든것이 불편한 세상이 됐군..
박나래,https://n.news.naver.com/mnews/article/023/0003606185?sid=102, 돌고 도는 미러링.. 되로 주고 말로 받는 거지 뭐.. 니들이 만든 사회니 불평불만 말고 받아들여라 페미들아. 
박나래,https://n.news.naver.com/mnews/article/023/0003606185?sid=102,  폐미들이 이 난리를 치는데 당연한 반사 효과 
박나래,https://n.news.naver.com/mnews/article/023/0003606185?sid=102, 아무리 유래를 몰랐어도 방송에서 일베말투를 썼다면 당연히 사과해야 하는 것과 마찬가지임
박나래,https://n.news.naver.com/mnews/article/023/0003606705?sid=103,"#양지은 님은 우리에게 기적입니다.언제나 밝고, 정말 따뜻 하세요. 매무대 마다 진하고 선한 감동을 주는 양지은님! 우리 모두의 국민의 가수 ! 늘 응원 합니다. 탑7도 응원해요!! ^^ 화이팅 "
박나래,https://n.news.naver.com/mnews/article/023/0003606705?sid=103, 나의 영원한 원픽 제주댁 양지은 평생 응원합니다❤❤❤ 
박나래,https://n.news.naver.com/mnews/article/023/0003606705?sid=103, 양지은 님과 함께 탑7의 매력은 어디까지인가요 내 딸하자 진심을 담아 노래부르고 심금을 울리고 감동을 주는 우리 탑칠이들 응원합니다 본방사수하러 가즈아~!! 화이팅~ 
박나래,https://n.news.naver.com/mnews/article/023/0003606705?sid=103,  양지은 가수님 덕분에 요즘 매일매일이 행복하고 즐겁습니다. 나의 사랑 나의 가수 양지은 응원합니다 화이팅! #양지은
박나래,https://n.news.naver.com/mnews/article/025/0003088334?sid=103,진짜 내로남불이 이렇게 까지 살기힘든 세상으로 변해버렸네 
박나래,https://n.news.naver.com/mnews/article/025/0003088334?sid=103, 참 별것도 아닌거 같은데 안타깝네요 힘내세요 박나래씨 
박나래,https://n.news.naver.com/mnews/article/025/0003088334?sid=103,   뻔뻔하게 계속 방송출연중 엠비씨도 이해불가 둘다 망해라
박나래,https://n.news.naver.com/mnews/article/469/0000591946?sid=103,위에 사진 보고 중국이나 홍콩 드라마인 줄 
박나래,https://n.news.naver.com/mnews/article/469/0000591946?sid=103,  선을 넘어도 한참 넘었다 
박나래,https://n.news.naver.com/mnews/article/469/0000591946?sid=103,  
박나래,https://n.news.naver.com/mnews/article/032/0003070819?sid=103,박나래 김숙 듬 여자 연예인들 남성희롱 남성혐오짓하고도 당당하게 방솔일하는 거 보면 남자 연예인에 대한 시선이 훨씬 엄격하고 잔인한데? 
박나래,https://n.news.naver.com/mnews/article/032/0003070819?sid=103, 좋은 기사 정말 감사합니다. 항상 이런 기사를 원해왔던 것 같아요. 
박나래,https://n.news.naver.com/mnews/article/032/0003070819?sid=103, 아이유 악플들은 죄다 여자들이 단거 아니었음? ㅋㅋㅋㅋㅋㅋㅋㅋㅋㅋㅋㅋㅋㅋㅋㅋㅋㅋㅋㅋㅋㅋㅋㅋㅋㅋㅋㅋㅋㅋㅋㅋㅋㅋㅋㅋㅋㅋㅋㅋㅋㅋㅋㅋ 
박나래,https://n.news.naver.com/mnews/article/032/0003070819?sid=103, 여자 연예인한테 악플달고 질투하다가 고소당하는 사람이나 뉴스기사 성비보면 여자가 압도적인데 이게 왜 남성중심사회로 귀결되나? 
박나래,https://n.news.naver.com/mnews/article/032/0003070819?sid=103, 취지와 행보가 너무 멋지십니다지금 댓글판만 봐도 알 수 있죠? 너무 욕이 많길래 저는 이 기사 어디에서 남성을 희롱하고 남성을 죽이겠다고 협박을 한다는줄 알았습니다ㅋㅋ 그저 단순히 여성이 죽어나가는 사회에서 여성의 성취를 기리는 기사를 쓰려는 것 뿐인데도 이렇게 여성들을 헐뜯고 여적여 프레임을 씌우려는 금수들이 많네요 이곳만 봐도 기자님들의 행보는 정말 필요한 일들이 될것이에요 감사드립니다
박나래,https://n.news.naver.com/mnews/article/032/0003065946?sid=103,숙취덜된 눈깔팅팅 부은 쌩얼로 감성팔이 훌쩍 훌쩍 사과하는마냥 가볍게 넘어가려고 하지말고 앞으론 말이든 행동이든 성 표현 관련 개그는 절대하지마라 진짜 역겹다 
박나래,https://n.news.naver.com/mnews/article/032/0003065946?sid=103, 남자가 했으면 바로 고발당했음. 
박나래,https://n.news.naver.com/mnews/article/032/0003065946?sid=103, 남자가 바비인형 ㅂㅈ비볐으면? 당근을 성기마냥 흔들어대는 모션하고 테이블 기둥을 발로 어휴 진짜 영상개역겹더라. 방송에서 안봤으면 좋겠다진짜. 티비나오면 채널돌리는 연예인중 한명이 변녀박나래임. 
박나래,https://n.news.naver.com/mnews/article/032/0003065946?sid=103, 폐지하면 끝? 박나래 은퇴해라 
박나래,https://n.news.naver.com/mnews/article/032/0003065946?sid=103," 남자 연예인이 여자 인형 가지고 나와서 똑같이 했다면 경향 1면 톱으로 기사 올리고 여성운동가들의 비난 칼럼 대문짝만하게 싣고 한국 남성 전체를 싸잡아 매도하고 여성단체들 몰려가서 퇴출시키라고 난리쳤겠지? 선택적 정의 패미, 좌파들 역겹다!"
박나래,https://n.news.naver.com/mnews/article/005/0001423766?sid=103,공중파에서도 술얘기 남자얘기 성적인발언 너무 하던데.. 애들도 다같이 보는 방송을 ... 골빈건가싶다 연예계 은퇴각 
박나래,https://n.news.naver.com/mnews/article/005/0001423766?sid=103,  절대비호감. 
박나래,https://n.news.naver.com/mnews/article/005/0001423766?sid=103, 채널넘기는 그잠깐도 보기싫은 예능인. 
박나래,https://n.news.naver.com/mnews/article/005/0001423766?sid=103, 
박나래,https://n.news.naver.com/mnews/article/005/0001423831?sid=103,"하차해라, 나래야. 도를 넘어도 너무 넘었어. 남성이 여성이 있는 곳에서 그렇게 했으면 거의 성추행???? "
박나래,https://n.news.naver.com/mnews/article/005/0001423831?sid=103, 입 닫고 제작진이 똥물 다 뒤집어 쓰고 잠잠해지기를 기다리는거 같은데 누가봐도 박나래가 방송 흐름상 자연스럽게 치고 들어온걸로 밖에 안보인다 하차해라 남성을 성적으로 희롱하는 방송인 보고싶지 않다 
박나래,https://n.news.naver.com/mnews/article/005/0001423831?sid=103,  박나래 수준이하 저질개그 언젠간 욕먹을 줄 알았다 당분간 자숙하면서 살이나 좀 빼라 
박나래,https://n.news.naver.com/mnews/article/005/0001423831?sid=103, 박나래 지는 사과문도안올리네 ㅋㅋㅋ 지가 피해자라고생각하나? 니는 사과도하지말고 걍전부하차해라 대상은 얼어죽을니땜시 애들 좋은거 잘봣다 야 꺼져
박나래,https://n.news.naver.com/mnews/article/020/0003346584?sid=102,왜 저래? 
박나래,https://n.news.naver.com/mnews/article/020/0003346584?sid=102, 헤이 지니라는 여자가 저기에 출연한 것 만으로도 저 여자 채널 자체가 어린이 보호 커뮤니티 위반에 해당한다고 봅니다. 
박나래,https://n.news.naver.com/mnews/article/020/0003346584?sid=102,  아슬아슬하더니 결국 터지는구나.오바한다 싶으면 반드시 사고 친다. 단순 실수가 아니라 얘들 속성이 이렇다. 밑바닥 들어내지. 
박나래,https://n.news.naver.com/mnews/article/020/0003346584?sid=102, 
박나래,https://n.news.naver.com/mnews/article/020/0003346803?sid=103, 즙짜지말고 화면에서 좀 사라졌으면.. 
박나래,https://n.news.naver.com/mnews/article/020/0003346803?sid=103, 만약 남자였음 바로 하차 시켰겠지... 욕이란 욕은 욕대로 먹었을거고 
박나래,https://n.news.naver.com/mnews/article/020/0003346803?sid=103, 박나래 없으면 예능 무슨 재미로 보냐 
박나래,https://n.news.naver.com/mnews/article/020/0003346803?sid=103, 박나래가 사회적으로 비판 받을 행동을 한건 사실이지만 이렇게 많은 비난과 일자리 위협을 받을 정도에 잘못을 한건 아니라고 봅니다 너무 과하고 무분별하게 비난 하는것이 아닐까요? 박나래도 사과했고 그 당시 방송영상 삭제하고 앞으로 조심하면 될 것 같네요.
박나래,https://n.news.naver.com/mnews/article/020/0003346829?sid=103,이유막론하고??? 그 이유나 한번 들어 봅시다!! 
박나래,https://n.news.naver.com/mnews/article/020/0003346829?sid=103, 헤이지니도 보기싫다 애들 이용해 장사 하는 거 같음 아이들 못보게 할거다! 
박나래,https://n.news.naver.com/mnews/article/020/0003346829?sid=103, 이유 막론하고? 미친 
박나래,https://n.news.naver.com/mnews/article/020/0003346829?sid=103,  
박나래,https://n.news.naver.com/mnews/article/081/0003173847?sid=102, 너무 조심성 없이 폭주했었다!!!!! 예견된 상황!!! 
박나래,https://n.news.naver.com/mnews/article/081/0003173847?sid=102,  얼굴보면 밥맛까지 떨어지더구만.. 
박나래,https://n.news.naver.com/mnews/article/081/0003173847?sid=102, 페미니즘이 뿌린 씨앗이다.
박나래,https://n.news.naver.com/mnews/article/081/0003173741?sid=103,박나래가 남자였다면.... 생각만해도 얼마나 국민적인 비난을 받을지 상상도 안 간다 
박나래,https://n.news.naver.com/mnews/article/081/0003173741?sid=103, 나오는프로마다 재미없던데 나혼산은 하차안하나? 
박나래,https://n.news.naver.com/mnews/article/081/0003173741?sid=103, 요즘 추세가 거침없이 발언하지 않나? 안영미 장도연 박나래 이셋이 특히 심하잖아. 안영미도 조심해라 도가지나치려하더라. 박나래 잘못 걸렸네. 
박나래,https://n.news.naver.com/mnews/article/081/0003173741?sid=103, 한번쯤 나자신을 돌아볼때가 됐지 ㅠ이제부터는 내리막이예요 브레이크 적절히 밟으세요^^ 솔직히 그동안 본인 재능에 비해서 과한 인기였죠 요즘은 나래 나오는 프로 다 재미없어요^^ 
박나래,https://n.news.naver.com/mnews/article/081/0003173741?sid=103, 나댈때부터 알아봤다
박나래,https://n.news.naver.com/mnews/article/081/0003173514?sid=103,미친거아냐? 
